{
  "$schema": "https://json-schema.org/draft/2020-12/schema",
  "$id": "https://aid-orchestrator.aidlab.dev/schemas/review-finding.schema.json",
  "title": "AID review — reviewer answer (plan review CP1, step review CP2, fast-mode review CP6, whole-plan review CP7)",
  "$comment": "producer: a reviewer (reviewer-<role>.json), consumers: aid-review-round.sh collect (answer shape) and aid-review-adjudicate.sh (each finding's proof). Both read the role lists and the two patterns from this file, so the contract has one source. The role set depends on the checkpoint: an answer without a checkpoint is a plan-review answer (cp1), which is what every answer recorded before P094 is.",
  "description": "One reviewer's answer for one review round. A finding without a read-only command (or a reproduction under the round's repro/ directory) and a path:line evidence does not exist.",
  "type": "object",
  "additionalProperties": false,
  "required": ["role", "findings"],
  "properties": {
    "security_and_operations": {
      "description": "final_generalist (CP7, AID 3.13.0): one typed answer to each security and operations question of skills/step-review-roles.md (Role: final_generalist, question 7); a finding goes in findings.",
      "type": "object", "additionalProperties": false,
      "required": ["personal_data", "host_layout", "ci_dependencies", "docs_build", "log_leaks", "account_boundaries", "injection", "paths_deletion", "forged_trust"],
      "properties": {"personal_data": {"$ref": "#/$defs/so_answer"}, "host_layout": {"$ref": "#/$defs/so_answer"}, "ci_dependencies": {"$ref": "#/$defs/so_answer"}, "docs_build": {"$ref": "#/$defs/so_answer"}, "log_leaks": {"$ref": "#/$defs/so_answer"}, "account_boundaries": {"$ref": "#/$defs/so_answer"}, "injection": {"$ref": "#/$defs/so_answer"}, "paths_deletion": {"$ref": "#/$defs/so_answer"}, "forged_trust": {"$ref": "#/$defs/so_answer"}}
    },
    "role": { "type": "string" },
    "checkpoint": { "$ref": "#/$defs/checkpoint" },
    "provider": { "type": "string" },
    "model": { "type": "string" },
    "findings": {
      "type": "array",
      "items": { "$ref": "#/$defs/finding" }
    },
    "no_findings_reason": { "type": "string", "minLength": 1 }
  },
  "allOf": [
    {
      "if": { "properties": { "findings": { "maxItems": 0 } } },
      "then": { "required": ["no_findings_reason"] }
    },
    {
      "if": { "anyOf": [ { "not": { "required": ["checkpoint"] } }, { "properties": { "checkpoint": { "const": "cp1" } } } ] },
      "then": { "properties": { "role": { "$ref": "#/$defs/roles_cp1" } } },
      "else": { "properties": { "role": { "$ref": "#/$defs/roles_step" } } }
    }
  ],
  "$defs": {
    "so_answer": {"type": "object", "additionalProperties": false, "required": ["answer"], "properties": {"answer": {"enum": ["none", "checked", "finding"]}, "note": {"type": "string"}}},
    "checkpoint": { "enum": ["cp1", "cp2", "cp6", "cp7"] },
    "roles_cp1": {
      "enum": ["generalist_a", "generalist_b", "behaviour_edges", "feasibility_deps", "reuse", "enforcement_tests"]
    },
    "roles_step": {
      "enum": ["step_generalist", "step_security", "final_criteria", "final_claims", "final_generalist"]
    },
    "finding": {
      "type": "object",
      "additionalProperties": false,
      "required": ["id", "step", "severity", "claim", "command", "evidence", "fix"],
      "properties": {
        "id": { "type": "string", "minLength": 1 },
        "checkpoint": { "$ref": "#/$defs/checkpoint" },
        "step": { "type": ["integer", "null"] },
        "severity": { "enum": ["blocker", "major", "minor"] },
        "claim": { "type": "string", "minLength": 1 },
        "command": {
          "type": "string",
          "pattern": "^(grep|rg|ls|find|sed -n|git grep|git log|git show|git diff|git blame|wc|head|tail|bash [^;|&>]+ --help|bash repro/[a-z0-9_-]+\\.sh|bash -c '[^']*')( |$)"
        },
        "evidence": {
          "type": "string",
          "pattern": "^(absent:[^:;]+|([0-9a-f]{7,40}:)?[^:;]+:[0-9]+(-[0-9]+)?)(; *(absent:[^:;]+|([0-9a-f]{7,40}:)?[^:;]+:[0-9]+(-[0-9]+)?))*$"
        },
        "fix": { "type": "string", "minLength": 1 },
        "rule": { "type": "string", "minLength": 1 },
        "behaviour_trace": {
          "type": "array",
          "minItems": 1,
          "items": {
            "type": "object",
            "additionalProperties": false,
            "required": ["request", "path", "sink", "branches"],
            "properties": {
              "request": { "type": "string", "minLength": 1 },
              "path": { "type": "string", "minLength": 1 },
              "sink": { "type": "string", "minLength": 1 },
              "branches": {
                "type": "array",
                "minItems": 1,
                "items": {
                  "type": "object",
                  "additionalProperties": false,
                  "required": ["name", "outcome"],
                  "properties": {
                    "name": { "type": "string", "minLength": 1 },
                    "outcome": { "type": "string", "minLength": 1 }
                  }
                }
              }
            }
          }
        }
      }
    }
  }
}
