{"role": "step_generalist", "checkpoint": "cp2", "findings": [], "no_findings_reason": "All AC verified against the repository: helpSections.ts adds anchors kdy-se-kontroluje and kontrola-uctu (frontend/src/config/helpSections.ts:142-143) with matching id= on both HelpSection elements in ProtistranyPage.tsx (lines 239, 297); lastReviewedPlan: 'P024' set (helpSections.ts:167) and the helpSections test was rewritten (not weakened) to still catch missing/duplicate plan-date pairs per plan. Chip labels 'Účet zveřejněn' and 'Účet není zveřejněn' in the new help text match registryChips() output verbatim (frontend/src/components/registry/RegistryBadge.tsx:150,164), the refresh button label 'Ověřit registrní stav teď' matches RegistryRefreshButton (RegistryBadge.tsx:313), and the viewer-role restriction claim matches its guard (RegistryBadge.tsx:301, 'if (me?.role === \"viewer\") return null'). The 03:20/04:10 nightly cron claim matches backend/acta/jobs/__init__.py:71-84 (refresh_registry_batch hour=3 covers VIES too, per backend/acta/registry/scheduler.py:1072-1099; refresh_ares_batch hour=4), and the 'oldest/never-checked first' ordering claim matches order_by(nullsfirst(...checked_at.asc())) in scheduler.py:631/643/715. The masked-threshold test (not matching 540 000 / 270 000) matches the real config value SECTION109_AMOUNT_THRESHOLD_CZK = 540_000 (backend/acta/config.py:78), so the help text correctly avoids hardcoding a value that can change without redeploy. 'Insolvence nezjištěna' phrase is retained (ProtistranyPage.tsx:223). The e2e/help-structure.spec.ts file is unchanged but is data-driven off HELP_SECTIONS and page DOM ids (frontend/e2e/help-structure.spec.ts:27-38), so the new anchors are exercised by the existing generic test without needing a diff — the files.json line listing it as an output is not a gap. All touched files are within allowed_paths; no forbidden path is touched."}
