{"role": "step_generalist", "checkpoint": "cp2", "findings": [], "no_findings_reason": "All three ACs are verified in behaviour, not just by name: (1) grep confirms cmd_dispatch always calls $INDEPENDENCE_BIN with 'detect --required cross_provider' regardless of the manifest's required_independence_level (aid-c3-dispatch.sh:353, exercised by bats test step5/AC1 which seeds a 'high' profile whose manifest-declared required level is cross_model and asserts the probe log contains only cross_provider); (2) the codex spy log asserts the exact 'exec --cd <repo> --sandbox read-only' argv in the valid fixture (test step5/AC2, aid-c3-dispatch.sh:227-235 _run_codex_isolated); (3) the non-sticky AC is asserted by two consecutive rate_limited runs both incrementing the codex-exec and detect-probe counters to 2, with no cache/availability artifact written under evidence_dir (test step5/AC3). Ran `bats scripts/tests/bats/test-aid-c3-dispatch.bats` from the checkout: 77/77 pass, including all step5 AC/edge/boundary cases (timeout, rate_limited x2, pre-check-unavailable, no_stream, invalid_json, render-failure path). Scope is exactly the two declared allowed_paths (aid-c3-dispatch.sh, test-aid-c3-dispatch.bats); grep shows no other caller of `aid-c3-dispatch.sh ... dispatch` in the plugin tree that the changed exit-code semantics (exit 2 stub -> exit 1 usage error) could break. _write_dispatch_json's 18 positional args line up 1:1 across all three call sites with its documented parameter list. The prompt-vars JSON keys assembled in cmd_dispatch match byte-for-byte the `variables:` list declared in the committed template's frontmatter (defaults/prompts/c3-audit-prompt-v1.md), so aid-render-prompt.sh's fail-closed missing/unknown-key check cannot reject them. Found no forbidden-path touches, no broken consumer, and no silent-wrong-result error/retry path."}
