{"role": "step_generalist", "checkpoint": "cp2", "findings": [{"id": "step_generalist-1", "checkpoint": "cp2", "step": 0, "severity": "blocker", "claim": "Přejmenování `ordinal` → `payload_ordinal` v `om_ownership_conflict` rozbíjí tři existující konzumenty na desktopu i mobilu, které krok nemění a mít ve scope nemůže: `SessionDetailPage.tsx` (setError, clearErrors, dropOmConflict, React key) a `SessionReviewMobile.tsx` (override checkbox) čtou `c.ordinal`, který server po tomto kroku už neposílá.", "command": "git grep -n \"c\\.ordinal\\|cc\\.ordinal\\|ordinal: number\" -- ui/src/pages/SessionDetailPage.tsx ui/src/pages/SessionReviewMobile.tsx ui/src/lib/validationErrors.ts", "evidence": "ui/src/lib/validationErrors.ts:222; ui/src/lib/validationErrors.ts:243; ui/src/pages/SessionDetailPage.tsx:1692; ui/src/pages/SessionDetailPage.tsx:2357; ui/src/pages/SessionDetailPage.tsx:2365; ui/src/pages/SessionDetailPage.tsx:422; ui/src/pages/SessionReviewMobile.tsx:735; wan/api/scan.py:4179", "fix": "Buď v `_build_om_conflict` po přechodnou dobu posílat i starý klíč `ordinal` (duplicitní hodnota, odstranit až ve Step 4), nebo rozšířit rozsah kroku o `validationErrors.ts` + oba konzumenty a přejmenovat je spolu se serverem; samotný `useSessions.ts`/`validationInbox.ts` nestačí."}, {"id": "step_generalist-2", "checkpoint": "cp2", "step": 0, "severity": "major", "claim": "Rozbití z nálezu 1 je TICHÉ a žádný test ho nechytí: `parseOmOwnershipConflictError` konflikty jen přetypuje (`as OmOwnershipConflict[]`), takže TS build projde, `ordinal` je za běhu `undefined`, `dropOmConflict(prev, undefined)` vyfiltruje VŠECHNY konflikty (banner zmizí i s nevyřešenými) a mobil zapíše override do neexistujícího pole `point_undefined_confirm_om_owner_conflict`.", "command": "sed -n '243,251p' ui/src/lib/validationErrors.ts; sed -n '417,423p;2355,2366p' ui/src/pages/SessionDetailPage.tsx", "evidence": "ui/src/lib/validationErrors.ts:243; ui/src/lib/validationErrors.ts:249; ui/src/pages/SessionDetailPage.tsx:422; ui/src/pages/SessionReviewMobile.tsx:735", "fix": "Spolu s opravou nálezu 1 doplnit test, který jde přes `parseOmOwnershipConflictError` na skutečném serverovém tvaru (ne přes ručně psanou fixturu s vlastním klíčem) — jinak se rozejití tvaru serveru a FE typu znovu nikde neprojeví; nebo v parseru validovat klíče místo přetypování."}], "no_findings_reason": ""}
