{"role": "step_security", "checkpoint": "cp2", "findings": [], "no_findings_reason": "Both matched rules are false positives: exec_keyword matches RegExp.prototype.exec() calls used for line parsing (frontend/scripts/parseChangelog.mjs:85,142,163), not code/shell execution; skipped_test matches process.exit() CLI exit-code calls (frontend/scripts/parseChangelog.mjs:334,381,391,396), not a skipped test. No shell, SQL, template or deserializer sink exists in the diff; the only external input is $CHANGELOG_PATH (frontend/scripts/parseChangelog.mjs:206-207), a repo-local dev/CI file path read with readFileSync (frontend/scripts/parseChangelog.mjs:212), not user- or network-supplied. There is no new endpoint, command, job, authorization surface or credential in the diff, and no test is skipped or disabled (frontend/src/lib/__tests__/parseChangelog.test.ts has no .skip/.todo/xit)."}
