{"role": "step_generalist", "checkpoint": "cp2", "findings": [], "no_findings_reason": "Traced every AC against the diff at 6c9314190588: role flip fields (backend/acta/convert/adapter.py:262-273 vs 279-290), f_invoice_number cis_dosle-then-kod (adapter.py:274 matching dod.md:5), is_reverse_charge restricted to typ==\"prijata\" and its non-skip wiring in should_skip (adapter.py:141-154, 208-212), ZÁLOHA skip added before currency check (adapter.py:188-189), RC line mapping keeping vat_rate with amount_vat=0 and the unconditional osv bucket (adapter.py:227-260), and the two independent uuid5 seeds (flexibee: vs flexibee-prijata:, adapter.py:239 vs 257-260) all match the code exactly and are each covered by a corresponding new test in backend/tests/convert/test_adapter.py that asserts real values (not just presence/name). Diff touches only the two declared allowed_paths, no forbidden path (bank_account, build_isdoc/_emit_party, persistence, other FlexiBee agendas) is touched — bank_account is merely set to a None literal for received invoices, not parsed. service.py (the only caller of should_skip/to_isdoc_document) calls both with unchanged signatures, so no consumer is broken. No error/retry/concurrency path is introduced. No name/number/claim in the diff's docstrings disagrees with the code (checked should_skip's declared rule order and the doc_id seed docstring against the actual implementation)."}
