{"role": "step_generalist", "checkpoint": "cp2", "findings": [], "no_findings_reason": "All three ACs verified by direct execution at commit 7ada49be: `bash plugins/aid-orchestrator/scripts/tests/test-protocol-validate.sh --consistency` exits 0 (CONSISTENCY PASS); `aid-protocol-validate.sh` on valid.json exits 0; on invalid-missing-payload.json exits 12 (missing_type_payload:plan_boundary_manifest). VALID_ARTIFACT_TYPES has exactly 20 entries matching the updated comment, and the schema enum gained the same two values (c3_dispatch, plan_boundary_manifest) so schema/validator stay in sync. Diff stays within declared allowed_paths (5 files, all listed); no forbidden paths touched. The new plan-boundary-manifest.schema.json is not $ref-loaded or enforced beyond payload-key presence, but this matches the established pattern for other type-specific schemas in defaults/schemas/ (e.g. waiver.schema.json, delivery-report.schema.json, verification-report.schema.json, invalidation-map.schema.json are likewise never referenced outside defaults/schemas/ by any .sh file) and the diff's own comments explicitly and correctly document this as descriptive-only, deferring field-level enforcement to a later step (lib/aid-plan-manifest.sh) named in the plan. No consumer of aid-protocol-validate.sh or the schema file is broken: c3_dispatch (added to the schema enum here) is already produced at lib/aid-c3-dispatch.sh:690 confirmed present. No error/retry/concurrency path is opened by this diff (pure additive lookup-table and schema-enum entries, plus two new fixtures)."}
