{"role": "step_generalist", "checkpoint": "cp2", "findings": [], "no_findings_reason": "All 4 acceptance criteria are met in behaviour, not just by name: helpSections.ts adds both 'vychozi-hodnoty' (frontend/src/config/helpSections.ts:107) and 'cislo-z-faktury' (frontend/src/config/helpSections.ts:156) sections with non-empty label/keywords, each has a matching <HelpSection id=...> on its page (frontend/src/pages/help/VydaneFakturyPage.tsx:193 and frontend/src/pages/help/CiselneRadyPage.tsx:205), REVIEW moved to lastReviewedPlan 'P018' (frontend/src/config/helpSections.ts:155) applied uniformly via spread to every page entry, and frontend/e2e/help-structure.spec.ts (unchanged, still generic over HELP_SECTIONS) structurally verifies every registry section id exists on its page and every anchor link resolves. The new unit tests (frontend/src/config/__tests__/helpSections.test.ts:60-141) assert non-empty id/label/keywords per new section and a uniform lastReviewedPlan, which is the cheapest sufficient proof for a static content registry (no existing test already covered these two new ids). Diff touches only the four declared allowed_paths; no forbidden path touched. Cross-checked the factual claims added to the docs against the current backend: default druh_dokladu 53/44 by direction matches backend/acta/docdefaults/service.py:48-52 (BUILTIN_DRUH_DOKLADU/builtin_druh_dokladu), and the doc's claim that a user's manual edit survives direction-triggered recomputation matches the edited_by_user guard in backend/acta/documents/router.py:762-774. No caller/consumer of the two edited .tsx files or of helpSections.ts is broken (only new content/icons added, no export signature changed), and no error/retry/concurrency path is introduced by this content-only change."}
