{"role": "step_generalist", "checkpoint": "cp2", "findings": [], "no_findings_reason": "All three ACs verified against the repo: (1) enforcement-registry.yaml has the c3_cross_provider_dispatch row with all 10 required keys (id/type/source/instruction/severity/surface/status/verdict/description/test), confirmed present at plugins/aid-orchestrator/defaults/enforcement-registry.yaml:344-353, and totals.enforcements=293 matches the actual row count (`yq '.enforcements|length'` = 293). (2) All 8 version-registry locations show 2.59.0: marketplace.json metadata.version + plugins[0].version, plugin.json version, root+plugin README version lines, and the root README license line is present unchanged (no version to carry). (3) Root and plugin CHANGELOG.md entries for [2.59.0] are byte-identical in the diff. The diff touches only files in allowed_paths/outputs; the added bats assertions in test-registry-ttl.bats read the shipped registry only (no code paths outside scope). Cross-checked the changelog/docs prose against the actual scripts/lib/aid-c3-dispatch.sh (build-manifest/dispatch/verify subcommands, _validate_response multi-document-JSON hardening, --reference flag) and scripts/aid-fsm.sh's C3 done-advance hook (observe-mode telemetry with fail-closed checks) — all technical claims made in this step's docs/CHANGELOG text match code that was already shipped in the prior steps of this same EPIC (steps 1-11, e.g. commit 66ac24d6 'P065 Step 11'), which is consistent with this step's declared scope of registry+docs+release bookkeeping only, not new implementation."}
