{"role": "step_generalist", "checkpoint": "cp2", "findings": [], "no_findings_reason": "All 6 ACs verified directly: test-help-index-coverage.bats 10/10 pass; '### Topic:' count (15) matches the Help Topics router list (15 lines, do/run/generation/plan/plan-lifecycle/status/gates/tests/audit/recovery/auto/config/init/setup/fsm) in commands/aid-help.md; the narrowed grep for 'execution.yaml.*lazy-created' returns nothing while the queue.yaml lazy-created line survives; plan_branch and legacy_epic_release_mode both appear verbatim inside the plan-lifecycle topic (commands/aid-help.md:220,222); awaiting_host_resume appears exactly once (moved intact into the new auto topic); aid-lint-skill.sh reports zero findings and commands/aid-help.md is removed from the GRANDFATHERED list in test-skill-lint.sh (confirmed absent via grep) with the suite's 5/5 passing. Diff stays within allowed_paths (commands/aid-help.md, defaults/help-index.yaml, scripts/tests/test-skill-lint.sh); test-owned-jobs-docs-closure.bats (which asserts blocked_for_pm's writer claim survives inside aid-help.md) still passes 10/10, so no existing consumer is broken. Spot-checked two factual claims moved/reworded in the diff against the actual scripts: execution.yaml is indeed composed eagerly and never overwritten by /aid-init (commands/aid-init.md:116-124, scripts/lib/aid-init-execution-yaml.sh), and plan_branch_unavailable: no_gate_profiles is a real logged reason (scripts/aid-plan-fsm.sh:9893, scripts/aid-plan-fsm.sh:1225) — both match the new prose. No untested addition needing a new test beyond the existing coverage/lint/docs-closure suites, which already assert the changed behaviour."}
