{"role": "step_generalist", "checkpoint": "cp2", "findings": [], "no_findings_reason": "All three declared changes verified against the repo at cb8c89cdc8fb: (1) c3-audit-policy.yaml gains exactly `c3_fix_loop.max_rechecks: 2` and `eligible_severities: [critical, high]` (plugins/aid-orchestrator/defaults/policies/c3-audit-policy.yaml:121-125). (2) aid-fsm.sh's added block is comment-only plus a genuinely additive `c3_recheck_count` telemetry read: `yaml_field` exists (scripts/aid-fsm.sh:75) and `state_file` is in scope as a `cmd_done_advance` local (scripts/aid-fsm.sh:3262), so the new `yaml_field \"$state_file\" c3_recheck_count` call at scripts/aid-fsm.sh:3921-3923 resolves correctly and only appends a field to the existing `log_event` call (scripts/aid-fsm.sh:3924-3927) without touching `c3_block_reason` or the enforcement branch below it — matching the AC's 'documentation only, no functional change' framing for this hook. `cmd_set_field` (scripts/aid-fsm.sh:3172) referenced by the new pipeline.md loop body correctly appends a not-yet-present field rather than requiring pre-existence, so `c3_recheck_count` can be created on first use. (3) pipeline.md's new step 6a (skills/pipeline.md:1279-1361) cites real artifacts: `review-checkpoints.yaml`'s `fix_loop.max_iterations: 2` exists verbatim (defaults/policies/review-checkpoints.yaml:20), and `aid-c3-dispatch.sh` supports the cited `build-manifest`/`dispatch`/`verify` subcommands (scripts/lib/aid-c3-dispatch.sh:1726-1732). The diff stays inside the declared allowed_paths (all three files match), touches no forbidden path, and the step legitimately adds no tests since it is a policy-value addition plus prose/comment documentation of an existing, already-tested code path (no new branching logic introduced)."}
